{
  "schema_version": 1,
  "sail_version": "0.0.0",
  "mode": "default",
  "command": [],
  "exit_code": 1,
  "solver": {
    "name": "z3",
    "version": "4.16.0",
    "path": null,
    "sha256": null
  },
  "cache": {
    "daemon": false
  },
  "attribution": {
    "status": "complete",
    "notes": [],
    "unmatched_sessions": 0
  },
  "crates": [
    {
      "name": "input",
      "verus": {
        "verified": 9,
        "errors": 2,
        "success": false,
        "encountered_vir_error": false
      },
      "functions": [
        {
          "function": "input::Counter::get",
          "module": "",
          "fn_mode": "exec",
          "verdict": "verified",
          "tier": "confirmed",
          "unstable": false,
          "verus_success": true,
          "provenance": {
            "mode": "default",
            "source": "fresh",
            "checks_solved": 1,
            "checks_served": 0,
            "checks_unrecorded": 0
          },
          "timing": {
            "smt_micros": 2497,
            "rlimit": 2
          },
          "fragility": null,
          "obligations": [
            {
              "id": "input::Counter::get#Function-Def/0",
              "kind": "Function-Def",
              "ordinal": 0,
              "spinoff": null,
              "advisory": false,
              "span": {
                "text": "input.rs:37:5: 37:33 (#0)",
                "file": "input.rs",
                "line": 37,
                "column": 5,
                "end_line": 37,
                "end_column": 33
              },
              "outcome": "proved",
              "unstable": false,
              "checks": [
                {
                  "answer": "unsat",
                  "rlimit_limit": 30000000,
                  "rlimit_used": 2,
                  "reason_unknown": null,
                  "source": "solved"
                }
              ],
              "counterexample": null
            }
          ]
        },
        {
          "function": "input::Counter::incr",
          "module": "",
          "fn_mode": "exec",
          "verdict": "verified",
          "tier": "confirmed",
          "unstable": false,
          "verus_success": true,
          "provenance": {
            "mode": "default",
            "source": "fresh",
            "checks_solved": 1,
            "checks_served": 0,
            "checks_unrecorded": 0
          },
          "timing": {
            "smt_micros": 13617,
            "rlimit": 1492
          },
          "fragility": null,
          "obligations": [
            {
              "id": "input::Counter::incr#Function-Def/0",
              "kind": "Function-Def",
              "ordinal": 0,
              "spinoff": null,
              "advisory": false,
              "span": {
                "text": "input.rs:30:5: 30:27 (#0)",
                "file": "input.rs",
                "line": 30,
                "column": 5,
                "end_line": 30,
                "end_column": 27
              },
              "outcome": "proved",
              "unstable": false,
              "checks": [
                {
                  "answer": "unsat",
                  "rlimit_limit": 30000000,
                  "rlimit_used": 1492,
                  "reason_unknown": null,
                  "source": "solved"
                }
              ],
              "counterexample": null
            }
          ]
        },
        {
          "function": "input::arith::bv_and",
          "module": "arith",
          "fn_mode": "proof",
          "verdict": "verified",
          "tier": "confirmed",
          "unstable": false,
          "verus_success": true,
          "provenance": {
            "mode": "default",
            "source": "fresh",
            "checks_solved": 2,
            "checks_served": 0,
            "checks_unrecorded": 0
          },
          "timing": {
            "smt_micros": 376,
            "rlimit": 6
          },
          "fragility": null,
          "obligations": [
            {
              "id": "input::arith::bv_and#Function-Def/0",
              "kind": "Function-Def",
              "ordinal": 0,
              "spinoff": null,
              "advisory": false,
              "span": {
                "text": "input.rs:15:5: 15:32 (#0)",
                "file": "input.rs",
                "line": 15,
                "column": 5,
                "end_line": 15,
                "end_column": 32
              },
              "outcome": "proved",
              "unstable": false,
              "checks": [
                {
                  "answer": "unsat",
                  "rlimit_limit": 30000000,
                  "rlimit_used": 2,
                  "reason_unknown": null,
                  "source": "solved"
                }
              ],
              "counterexample": null
            },
            {
              "id": "input::arith::bv_and#Function-Def/spinoff-1",
              "kind": "Function-Def",
              "ordinal": 0,
              "spinoff": {
                "index": 1,
                "reason": "bitvector"
              },
              "advisory": false,
              "span": {
                "text": "input.rs:18:9: 18:15 (#0)",
                "file": "input.rs",
                "line": 18,
                "column": 9,
                "end_line": 18,
                "end_column": 15
              },
              "outcome": "proved",
              "unstable": false,
              "checks": [
                {
                  "answer": "unsat",
                  "rlimit_limit": 30000000,
                  "rlimit_used": 4,
                  "reason_unknown": null,
                  "source": "solved"
                }
              ],
              "counterexample": null
            }
          ]
        },
        {
          "function": "input::arith::bv_bad",
          "module": "arith",
          "fn_mode": "proof",
          "verdict": "failed",
          "tier": "confirmed",
          "unstable": false,
          "verus_success": true,
          "provenance": {
            "mode": "default",
            "source": "fresh",
            "checks_solved": 3,
            "checks_served": 0,
            "checks_unrecorded": 0
          },
          "timing": {
            "smt_micros": 982,
            "rlimit": 158
          },
          "fragility": null,
          "obligations": [
            {
              "id": "input::arith::bv_bad#Function-Def/0",
              "kind": "Function-Def",
              "ordinal": 0,
              "spinoff": null,
              "advisory": false,
              "span": {
                "text": "input.rs:21:5: 21:32 (#0)",
                "file": "input.rs",
                "line": 21,
                "column": 5,
                "end_line": 21,
                "end_column": 32
              },
              "outcome": "proved",
              "unstable": false,
              "checks": [
                {
                  "answer": "unsat",
                  "rlimit_limit": 30000000,
                  "rlimit_used": 2,
                  "reason_unknown": null,
                  "source": "solved"
                }
              ],
              "counterexample": null
            },
            {
              "id": "input::arith::bv_bad#Function-Recommends/0",
              "kind": "Function-Recommends",
              "ordinal": 0,
              "spinoff": null,
              "advisory": true,
              "span": {
                "text": "input.rs:21:5: 21:32 (#0)",
                "file": "input.rs",
                "line": 21,
                "column": 5,
                "end_line": 21,
                "end_column": 32
              },
              "outcome": "proved",
              "unstable": false,
              "checks": [
                {
                  "answer": "unsat",
                  "rlimit_limit": 30000000,
                  "rlimit_used": 2,
                  "reason_unknown": null,
                  "source": "solved"
                }
              ],
              "counterexample": null
            },
            {
              "id": "input::arith::bv_bad#Function-Def/spinoff-1",
              "kind": "Function-Def",
              "ordinal": 0,
              "spinoff": {
                "index": 1,
                "reason": "bitvector"
              },
              "advisory": false,
              "span": {
                "text": "input.rs:23:9: 23:15 (#0)",
                "file": "input.rs",
                "line": 23,
                "column": 9,
                "end_line": 23,
                "end_column": 15
              },
              "outcome": "failed",
              "unstable": false,
              "checks": [
                {
                  "answer": "sat",
                  "rlimit_limit": 30000000,
                  "rlimit_used": 154,
                  "reason_unknown": null,
                  "source": "solved"
                }
              ],
              "counterexample": null
            }
          ]
        },
        {
          "function": "input::arith::mul_pos",
          "module": "arith",
          "fn_mode": "proof",
          "verdict": "verified",
          "tier": "confirmed",
          "unstable": false,
          "verus_success": true,
          "provenance": {
            "mode": "default",
            "source": "fresh",
            "checks_solved": 2,
            "checks_served": 0,
            "checks_unrecorded": 0
          },
          "timing": {
            "smt_micros": 1389,
            "rlimit": 470
          },
          "fragility": null,
          "obligations": [
            {
              "id": "input::arith::mul_pos#Function-Def/0",
              "kind": "Function-Def",
              "ordinal": 0,
              "spinoff": null,
              "advisory": false,
              "span": {
                "text": "input.rs:7:5: 7:41 (#0)",